<?xml version="1.0" encoding="UTF-8"?>
<xs:schema xmlns:xs="http://www.w3.org/2001/XMLSchema">
	<xs:element name="list">
		<xs:complexType>
			<xs:sequence maxOccurs="unbounded" minOccurs="1">
				<xs:element name="access" maxOccurs="unbounded" minOccurs="0">
					<xs:complexType>
						<xs:sequence minOccurs="1" maxOccurs="unbounded">
							<xs:element name="set" minOccurs="1" maxOccurs="unbounded">
								<xs:complexType>
									<xs:attribute name="name" type="xs:string" />
									<xs:attribute name="val" type="xs:string" />
								</xs:complexType>
							</xs:element>
						</xs:sequence>
						<xs:attribute name="level" type="xs:integer" use="required" />
						<xs:attribute name="name" type="xs:normalizedString" use="required" />
						<xs:attribute name="nameColor" type="xs:hexBinary" use="required" />
						<xs:attribute name="titleColor" type="xs:hexBinary" use="required" />
						<xs:attribute name="childAccess" type="xs:nonNegativeInteger" />
						<xs:attribute name="isGM" type="xs:boolean" use="required" />
					</xs:complexType>
				</xs:element>
			</xs:sequence>
		</xs:complexType>
	</xs:element>
</xs:schema>